{
  "$schema": "https://json-schema.org/draft/2020-12/schema",
  "$id": "https://example.com/concept-to-code/spec-schema.json",
  "title": "concept-to-code concept specification",
  "description": "Intermediate representation emitted before Rust stubs or verifier contracts are generated.",
  "type": "object",
  "additionalProperties": false,
  "required": [
    "schema_version",
    "concept",
    "cluster",
    "english_description",
    "queries",
    "commands",
    "constraints",
    "adversary_table",
    "verifier"
  ],
  "properties": {
    "schema_version": {
      "type": "string",
      "const": "1.0",
      "description": "Schema version for deterministic stub generation."
    },
    "concept": {
      "type": "string",
      "pattern": "^[A-Z][A-Za-z0-9]*$",
      "description": "Restricted-English concept name. This is not a Rust type declaration."
    },
    "cluster": {
      "type": "string",
      "pattern": "^[a-z][a-z0-9-]*$",
      "description": "Domain cluster that groups related concepts, such as parsing, data-model, or numeric-kernel."
    },
    "english_description": {
      "type": "string",
      "minLength": 20,
      "description": "Restricted-English description of the concept before implementation vocabulary is introduced."
    },
    "queries": {
      "type": "array",
      "minItems": 1,
      "items": {
        "$ref": "#/$defs/query"
      }
    },
    "commands": {
      "type": "array",
      "items": {
        "$ref": "#/$defs/command"
      },
      "description": "Constructors and state-changing behaviors. May be empty when the concept is purely observational (e.g. a read-only view over storage owned by another concept)."
    },
    "constraints": {
      "type": "array",
      "minItems": 1,
      "items": {
        "$ref": "#/$defs/constraint"
      }
    },
    "adversary_table": {
      "type": "array",
      "minItems": 1,
      "items": {
        "$ref": "#/$defs/adversary_case"
      },
      "description": "Required counterexample table. Step A cannot advance while this is empty."
    },
    "verifier": {
      "type": "string",
      "enum": [
        "kani",
        "creusot",
        "verus"
      ],
      "description": "Verifier target used when generated stubs are checked."
    },
    "source_references": {
      "type": "array",
      "items": {
        "$ref": "#/$defs/source_reference"
      },
      "description": "Optional papers, reference-implementation classes, or implementation files that ground the specification."
    },
    "supplementary_imports": {
      "type": "array",
      "items": {
        "type": "string",
        "minLength": 3
      },
      "description": "Optional list of Rust use-paths to emit at the top of the generated stub module. Use this when a constraint logic expression or a constructor signature references types/constants/functions that live in a sibling support module (e.g. forward-referenced error types, named constants used in invariants, helper predicates like is_nfc). Each entry is the path portion of a `use` statement: e.g. \"crate::string_support::*\" emits `use crate::string_support::*;`."
    }
  },
  "$defs": {
    "query": {
      "type": "object",
      "additionalProperties": false,
      "required": [
        "english",
        "rust_sig",
        "pure"
      ],
      "properties": {
        "english": {
          "type": "string",
          "minLength": 10,
          "description": "Restricted-English question, kept verbatim as Rustdoc on the generated query."
        },
        "rust_sig": {
          "type": "string",
          "pattern": "^fn\\s+[A-Za-z_][A-Za-z0-9_]*\\s*\\(&self[),]",
          "description": "Rust method signature. Queries must take &self and return a value."
        },
        "pure": {
          "type": "boolean",
          "const": true,
          "description": "Queries are pure by construction; Step B rejects mutable query signatures."
        }
      }
    },
    "command": {
      "type": "object",
      "additionalProperties": false,
      "required": [
        "english",
        "rust_sig"
      ],
      "properties": {
        "english": {
          "type": "string",
          "minLength": 10,
          "description": "Restricted-English imperative statement, kept verbatim as Rustdoc on the generated command."
        },
        "rust_sig": {
          "type": "string",
          "pattern": "^fn\\s+[A-Za-z_][A-Za-z0-9_]*\\s*\\(&mut\\s+self|^fn\\s+[A-Za-z_][A-Za-z0-9_]*\\s*\\(",
          "description": "Rust method signature for state-changing behavior or constructors."
        }
      }
    },
    "constraint": {
      "type": "object",
      "additionalProperties": false,
      "required": [
        "english",
        "logic"
      ],
      "properties": {
        "english": {
          "type": "string",
          "minLength": 10,
          "description": "Restricted-English invariant, precondition, or postcondition."
        },
        "logic": {
          "type": "string",
          "minLength": 3,
          "description": "Rust-boolean-subset expression consumed by contract and property-test generators."
        },
        "kind": {
          "type": "string",
          "enum": [
            "invariant",
            "precondition",
            "postcondition"
          ],
          "default": "invariant"
        },
        "source": {
          "type": "string",
          "enum": [
            "hand",
            "daikon",
            "llmlift",
            "oracle-doc"
          ],
          "default": "hand",
          "description": "Provenance tag. 'daikon' means trace-inferred from a reference implementation by an external invariant-mining tool (e.g. Daikon); constraints with this tag must be reviewed before promotion into the main spec."
        },
        "applies_to": {
          "type": "array",
          "items": {
            "type": "string"
          },
          "description": "Optional query or command names this constraint applies to."
        }
      }
    },
    "adversary_case": {
      "type": "object",
      "additionalProperties": false,
      "required": [
        "scenario",
        "violates",
        "resolution"
      ],
      "properties": {
        "scenario": {
          "type": "string",
          "minLength": 10,
          "description": "Concrete bad input, edge case, or reference-implementation divergence attempt."
        },
        "violates": {
          "type": "string",
          "minLength": 3,
          "description": "Constraint or behavior the scenario attempts to break."
        },
        "resolution": {
          "type": "string",
          "minLength": 3,
          "description": "Expected handling: reject, normalize, panic-free error, or preserve reference-implementation behavior."
        }
      }
    },
    "source_reference": {
      "type": "object",
      "additionalProperties": false,
      "required": [
        "kind",
        "citation_or_path"
      ],
      "properties": {
        "kind": {
          "type": "string",
          "enum": [
            "paper",
            "oracle-class",
            "oracle-file",
            "reference-implementation",
            "issue",
            "other"
          ]
        },
        "citation_or_path": {
          "type": "string",
          "minLength": 3
        },
        "notes": {
          "type": "string"
        }
      }
    }
  }
}
